/fbo/web/app.php/user/product/202	車坂　純米吟醸　古道生原酒	NA	NA	NA	<使用米>(%)	＜麹米＞(%)	＜掛米＞(%)	NA	NA	NA	NA	NA	NA	生原酒	シャープな高い酸が主体だが柔らかな熟した果物の甘い香りもあり、全体に複雑な香りが特徴。やや辛口。	日本酒通向け、秋から冬にかけて	常温（２０℃位）又は熱燗（４５℃位）	厚手のグイ呑（白または乳白色）、広口の盃など	濃い目の味付けの料理。すき焼き、牡蠣の土手鍋、牛肉のピーマン炒め、回鍋肉など	
/fbo/web/app.php/user/product/203	日本城　根来	NA	NA	NA	<使用米>(%)	＜麹米＞(%)	＜掛米＞(%)	NA	NA	NA	NA	NA	NA	NA	シャープな酸味、木の子や草のような爽やかな印象。やや辛口	日常的にアルコール類に親しんでいる方。秋から冬にかけて、軽く冷やすか常温で。	１５℃～１８℃又は２０℃前後	シェリーグラス、薄手のグイ飲み（白）など	香味、味わいに刺激のある料理。生ハム、燻製ソーセージ、クレソンなどの香草を使った魚料理やサラダなど	
/fbo/web/app.php/user/product/204	玉乃光　純米吟醸　酒魂くろ	NA	NA	NA	<使用米>(%)	＜麹米＞(%)	＜掛米＞(%)	NA	NA	NA	NA	NA	NA	NA	純米吟醸だが乳製品のようなふくよかな香りを持ち、豊かな酸味が特徴的なキリリとした濃醇な味わい	幅広い料理に合わせて食中酒として楽しむ	20℃前後、あるいは35℃前後	陶器、磁器の猪口、ぐい呑みなど	鶏の水炊き、太刀魚の塩焼き、牛肉のしゃぶしゃぶ（胡麻だれ）、牡蠣料理、チーズなど	
/fbo/web/app.php/user/product/205	玉乃光　純米大吟醸　伝承山廃仕込み　山田錦100％	NA	NA	NA	<使用米>山田錦(%)	＜麹米＞(%)	＜掛米＞(%)	NA	NA	NA	NA	NA	NA	NA	純米大吟醸だが旨味を思わせるチーズや穀物類のふくよかな香りが豊か。やや濃醇な味わいだがあくまでも上品で繊細。コクはあるがキレがいい	幅広い料理に合わせて食中酒として楽しむ	20℃前後、あるいは35℃前後	陶器、磁器の猪口、ぐい呑み、酒杯など	胡麻サバ、アワビの刺身、牡蠣料理、鰆やマナガツオの西京焼、甘鯛の蕪蒸し、ハードタイプのチーズなど	
/fbo/web/app.php/user/product/208	KONISHI　ナッツとよく合うお酒	NA	NA	NA	<使用米>(%)	＜麹米＞(%)	＜掛米＞(%)	NA	NA	NA	NA	NA	NA	NA	熟したミカンの香りの中にドライフルーツの凝縮感のある香り。口当たりはなめらかだが、序盤には濃厚な甘味、中盤から芳醇な酸味が立ち上がり余韻まで続く。梅酒のテイストを持った酒	ちょっとおしゃれに１人で静かに飲みたい時に	15℃前後	小さなワイングラス、白磁の鷹盃、ショットグラスなど	鶏肉のカシューナッツ炒め、鶏肉のタイ風バジル炒め、マナガツオの唐揚げの辛ソースなど	
/fbo/web/app.php/user/product/209	純米酒　トップ水雷	NA	NA	NA	<使用米>(%)	＜麹米＞(%)	＜掛米＞(%)	NA	NA	NA	NA	NA	NA	NA	強い酸味と旨みの余韻が特徴	春～秋、常温よし	18℃前後又は40℃前後	グイ呑み、小ぶりのグラスなど	和食一般、濃味の野菜料理、肉料理など	
/fbo/web/app.php/user/product/210	豊の秋　純米ひやおろし生詰原酒　	NA	NA	NA	<使用米>(%)	＜麹米＞(%)	＜掛米＞(%)	NA	NA	NA	NA	NA	NA	生詰原酒	熟成感のあるほのかな甘みのやや辛口	秋～冬、常温よし	15～20℃	グイ呑み、小ぶりのグラスなど	和食一般、白身の刺身、薄味の野菜料理など	
/fbo/web/app.php/user/product/213	山廃仕込純米酒	NA	NA	NA	<使用米>(%)	＜麹米＞(%)	＜掛米＞(%)	NA	NA	NA	NA	NA	NA	山廃仕込み	やや複雑な香りと旨味苦味酸味のしっかりしたどっしりとした味わい。	秋冬向け。濃い味付けや油気のある料理と共に食中酒として	30-40℃	和製の焼物など	クリームソースを使った料理全般など	
/fbo/web/app.php/user/product/214	山田錦純米吟醸　ひやおろし	NA	NA	NA	<使用米>(%)	＜麹米＞(%)	＜掛米＞(%)	NA	NA	NA	NA	NA	NA	NA	甘味とアルコールのしっかりしたアタックに始まり、さっと引く短い余韻に終わる味わい。	一年中対応可能。食中酒として	10〜15℃	ミニサイズの酒器（事前に冷やしておいたもの）など	脂ののった魚介類の刺身、旬のサンマ刺身、カツオ刺身、ブリ刺身など	
/fbo/web/app.php/user/product/217	深山菊　秘蔵　特別純米	NA	NA	NA	<使用米>(%)	＜麹米＞(%)	＜掛米＞(%)	NA	NA	NA	NA	NA	NA	NA			NA	NA	NA	
/fbo/web/app.php/user/product/219	純米大吟醸　生酛　招徳	NA	NA	NA	<使用米>(%)	＜麹米＞(%)	＜掛米＞(%)	NA	NA	NA	NA	NA	NA	生酛			NA	NA	NA	
/fbo/web/app.php/user/product/220	出羽ノ雪　生酛特別純米　自然酒	NA	1800ml	¥2,350	<使用米>ササニシキ(60%)	＜麹米＞(%)	＜掛米＞(%)	山形KA・きょうかい701号	生もと	15.3	+0	1.7	0.8	生酛仕込み	乳製品のようなふくよかな香り。ミディアムボディ～フルボディテイスト。しっかりした酸味が特徴	ビギナーから日本酒通まで対応可。ややフォーマルなシーン向け（和）。燗向け。濃厚な料理に合う。	２０℃前後または４５℃前後	備前焼、呑み口の広がった平杯、白磁の猪口など	焼き鳥（タレ）、豚の角煮、酢豚、牛肉の味噌漬け焼きなど、脂ののった料理と好相性	
/fbo/web/app.php/user/product/221	旭日　生もと純米酒	NA	1800ml	¥2,858	<使用米>山田錦(70%)	＜麹米＞(%)	＜掛米＞(%)	自社酵母	生もと	15.0	+2	1.8	-	NA	乳製品のようなクリーミーな香り。まろやかな飲み口。辛口ながら酸味や甘味がアクセントになった味わい	特に秋冬向け。外国人向け。日本酒通向け。食中酒向け。常温からぬる燗向け。和のシーン向け。	18℃前後または40℃前後	中型のワイングラス、平杯など	甘海老の刺身、鰆の西京漬け、有機野菜の煮物、シーフードグラタン、カマンベールチーズなど	
/fbo/web/app.php/user/product/222	一ノ蔵　山廃特別純米酒　円融	NA	1800ml	¥2,305	<使用米>ささろまん(60%)	＜麹米＞(%)	＜掛米＞(%)	自社酵母	山廃	15	2	1.8	1.6	山廃仕込み	輝く山吹の色調。木質、乳製品のような穏やかな香り。やや濃醇な味わい。後味は爽やか	特に秋冬向け。日本酒通向け。和のシーン向け。食中酒でも酒の肴でも対応可。飲用温度帯の幅が広い。	15～18℃または40℃前後	透明なラッパ型グラス、白磁の平杯、小型ロックグラスなど	牡蠣料理、アナゴの天ぷら、生ハム、ホヤの塩辛、イクラ醤油漬けなど濃厚な料理や肴類が好相性	
/fbo/web/app.php/user/product/223	男山　生もと純米	NA	1800ml	¥2,196	<使用米>美山錦(60%)	＜麹米＞(%)	＜掛米＞(%)	きょうかい7号	生もと	15	+3	1.8	1	生酛仕込み	生もと系純米酒の中では軽快な味わい。飲み口を引き締めるシャープな酸味と、キリリとしたドライな後味が特徴	通年向け。カジュアルシーン向け。食中酒向け（北海道料理と好相性）。冷酒でも燗酒でも対応可。	15℃前後または45～50℃前後	小型ワイングラス、日本酒用冷酒グラス、フルートグラスなど	スルメイカの刺身、石狩鍋、花咲きガニ、茹でアスパラガス、生ウニなど北海道の新鮮な食材と好相性	
/fbo/web/app.php/user/product/225	新政　秋田流　純米酒	NA	1800ml	¥2,076	<使用米>(%)	＜麹米＞吟の精(50%)	＜掛米＞秋田酒こまち(60%)	きょうかい601号	生もと	15	+1.0	1.8	1	NA	甘味と酸味が明確。甘やかなでクリーミーな香り。チャーミングな味わいの生もと系純米酒。	通年向け。日本酒通向け。カジュアルでお洒落なシーン向け。和イメージ、洋イメージにも適合。冷酒向け。	10～15℃	白磁の平杯、カット入りのショットグラス、切子類、錫製の猪口など	キノコのクリーム煮、ウオッシュタイプチーズ、シーフードグラタン、しょっつる鍋、イカの沖漬け、カラスミ	
/fbo/web/app.php/user/product/226	鳴門鯛　特別純米酒	NA	1800ml	¥2,300	<使用米>阿波山田錦(60%)	＜麹米＞(%)	＜掛米＞(%)	熊本系	山廃	15.5	+4	1.4	1.4	NA	磯の香りを持つ純米酒。ふくよかな旨味が特徴だが、アタックの甘味、後味のドライ感が融合	特に秋冬向け。日本酒通向け。和のシーン向け。食中酒向け。燗向け。	18℃前後または40～45℃	備前焼の猪口、白磁の平杯、一般的なぐい呑みなど	海草サラダ、白身魚の昆布〆、生牡蠣、岩牡蠣、海苔や山菜の天ぷら（抹茶塩）など磯の風味を持つ料理	
/fbo/web/app.php/user/product/227	萬歳楽　山廃純米酒　剱	NA	1800ml	¥2,095	<使用米>五百万石(68%)	＜麹米＞(%)	＜掛米＞(%)	きょうかい701号	山廃	15.8	+7	1.8	1.4	山廃仕込み	山廃造りの濃醇さが楽しめる一本。コクのある辛口。	日本酒通向け。特に秋冬向け。ぬる燗向け。和のシーン向け。食中酒向け	20℃前後または45～50℃	白磁のぐい呑み、大振りの平盃など	鴨の治部煮、牛肉のしぐれ煮、焼き鳥（タレ）、すきやき、豚の角煮など濃厚な肉料理と好相性	
/fbo/web/app.php/user/product/228	榮川　特別純米酒	NA	1800ml	¥2,476	<使用米>美山錦(%)	＜麹米＞(55%)	＜掛米＞(60%)	自社酵母	速醸	15.3	+4	1.1	1.3	NA	純米酒の中では軽快なテイスト。酸味と旨味バランスよし。やや辛口。	季節問わない。日本酒中級者向け。カジュアルなシーン向け。友人との語らいの場向け。食中酒向け。	15～18℃または40度前後	中型ワイングラス、平杯、薄手の磁器のぐい呑みなど	湯葉、おぼろ豆腐、茶碗蒸し、白身魚の酒蒸し、出汁巻き玉子、蒸しアナゴ等、なめらかな食感の料理と好相性	
/fbo/web/app.php/user/product/229	開華　純米酒	NA	1800ml	¥2,000	<使用米>(65%)	＜麹米＞五百万石(%)	＜掛米＞あさひの夢(%)	栃木酵母	速醸	14.5	+2	1.5	1	NA	原料の米由来の香りは軽快。穏やかな旨味が特徴の純米酒。やや辛口。	季節問わない。万人向け。カジュアルなシーン向け。仲間との宴会向け。食中酒向け。冷やからぬる燗まで対応	10～18℃または40度前後	平杯、磁器製のぐい呑み、中型タンブラー、小型ワイングラスなど	鰤の塩焼き、海老の天ぷら、生ウニ、マグロ中落ち、鶏モモ肉のソテー、広東風五目野菜のうま煮などと好相性	
/fbo/web/app.php/user/product/230	嘉美心　特別純米　桃花源	NA	1800ml	¥2,480	<使用米>アケボノ・アキヒカリ(58%)	＜麹米＞(%)	＜掛米＞(%)	きょうかい901号・岡山白桃酵母	速醸	14.5	+6.5	1.3	1.2	NA	まろやかな米の香りと、明確な甘味が特徴。やや軽快な酒質。	通年向け。女性向け。カジュアルなシーン向け。食中酒向け。冷や向け。和食向け	15℃前後	うりざね型グラス、中型ワイングラス、口径の大きなぐい呑みなど	平目の薄造り、鯛の酒蒸し、しらうおの天ぷら、ハマグリの塩焼き、生牡蠣、イイダコの柔らか煮など	
/fbo/web/app.php/user/product/231	菊姫　先一杯	NA	1800ml	¥2,381	<使用米>山田錦(65%)	＜麹米＞(%)	＜掛米＞(%)	自社酵母	速醸	14.4	+0	1.6	1.5	NA	どっしりとした香りと味わいが特徴。骨太の酸味としっかりした旨味、苦味が調和。辛口。	特に秋冬向け。日本酒通向け。燗向け。中国料理店向け。酒と肴向け。和のシーン向け	20℃前後または45℃前後	白磁のぐい呑み、大振りの平盃など	牛スジ煮込み、サーロインステーキ、鴨鍋、豚の角煮、牛肉のオイスターソース炒め、北京ダックなど	
/fbo/web/app.php/user/product/233	梅錦　純米酒　米の彩	NA	1800ml	¥1,821	<使用米>(%)	＜麹米＞玉栄・山田錦(65%)	＜掛米＞八反錦・愛のゆめ(70%)	きょうかい9号	速醸	15.3	+5.3	1.6	1.2	NA	軽快な苦味が主体のドライテイスト。ほどよい旨味が特徴	通年向け。万人向け。寿司などの和食向け。食中酒向け。冷やでも燗でも対応可	15～18℃または45℃前後	ブルゴーニュ型グラス、薄手のラッパ型タンブラー、磁器製の平杯など	鯛の塩焼き、アサリの酒蒸し、茹でワタリガニ、鱧のおとし梅肉あえ、にぎり寿司、キスの天ぷら	
/fbo/web/app.php/user/product/236	仙禽　純米　葵日光	NA	1800ml	¥1,696	<使用米>(%)	＜麹米＞(78%)	＜掛米＞(78%)	NA	NA	15	+3	1.8	1.2	NA	ふっくらと炊き上がったご飯のような印象の純米酒。ほどよい旨味が特徴。最初に甘味も感じるが、後味は辛口に。	特に秋冬向け。日本酒通向け。和食向け。常温からぬる燗向け。和のシーン向け。	18℃前後または40～50℃	厚手のグイ呑み、うりざね型グラス、大振りの平杯など	牡蠣の土手鍋、鯖の味噌煮、秋刀魚の塩焼き、鶏の立田揚げ、豚肉の味噌漬け焼き、鰤大根などの和食と好相性	
/fbo/web/app.php/user/product/237	開華　特別純米原酒　みがき竹皮	NA	1800ml	¥3,000	<使用米>(%)	＜麹米＞五百万石(59%)	＜掛米＞あさひの夢・ひとごごち(59%)	栃木酵母	速醸	17.5	+3	1.8	1.1	NA	原酒ならではのコクとキレを持った純米酒。後味の力強い辛口感が特徴	通年向け。男性向け。和のシーン向け。友人との語らい向け。食中酒向け。	18℃前後または45℃前後	小振りの猪口、小型のぐい呑みなど	鰺の塩焼き（スダチ添え）、牛タン塩焼き（レモン添え）など、柑橘類を添えた塩焼き料理と好相性	
/fbo/web/app.php/user/product/238	若竹鬼ころし　純米（特別純米原酒）	NA	1800ml	¥2,500	<使用米>(%)	＜麹米＞五百万石(60%)	＜掛米＞あいちのかおり(60%)	静岡酵母（NO-2）	速醸	17.5	+8	1.4	1.2	原酒	原酒らしいコクとキレを持つ特別純米酒。後味のキレのよさが特徴	特に夏向け。男性向け。和のシーン以外でも対応可。エスニック料理と好相性。冷酒向け	10～15℃	薄手の磁器、切子類、竹の猪口、錫の猪口、小型ロックグラスなど	鶏モモ肉の塩焼き（柚子胡椒）、豚の角煮（五香粉）、プルコギ、タンドリーチキン、羊肉のクスクスなど	
/fbo/web/app.php/user/product/244	菊秀　純米酒	NA	1800ml	¥2,300	<使用米>美山錦(65%)	＜麹米＞(%)	＜掛米＞(%)	きょうかい901号	速醸	15.1	+3	1.5	2.1	NA	やや濃醇な酒質で、後味は辛口。ふっくらとした飲み口も特徴	特に秋冬向け。高年齢の男性向け。和食向け。魚介料理向け。家庭料理向け。常温から燗酒向け	20℃前後または40～45℃	焼き物のぐい飲みや猪口類など	鰺の開き、イカと大根の煮物、鰯の生姜煮、カレイの一夜干し、牡蠣の土手鍋、揚げ出し豆腐、鰤の照焼きなど	
/fbo/web/app.php/user/product/245	嘉美心　特別純米酒　渚のうた	NA	1800ml	¥2,300	<使用米>アケボノ・アキヒカリ(58%)	＜麹米＞(%)	＜掛米＞(%)	きょうかい901号・岡山白桃酵母	速醸	14.5	+2.5	1.25	1.2	NA	優しい甘味が持ち味の軽快な特別純米酒。サラリとした優しい味わいが特徴	夏向け。女性向け。冷や向け。食中酒向け（特に前菜類）。カジュアルシーン向け	5～10℃	萩焼の猪口、白磁の平杯、薄手小型のタンブラーなど	豆腐料理、茶碗蒸し、穴子の白焼き、白子ポン酢、帆立貝のグラタン、モッツアレラチーズとトマトのサラダ等	
/fbo/web/app.php/user/product/246	賀茂泉　造賀　純米酒	NA	1800ml	¥2,500	<使用米>山田錦(65%)	＜麹米＞(%)	＜掛米＞(%)	熊本酵母	速醸	15	+0	1.8	1.5	NA	柔らかな甘みのある純米酒。平均的な醇酒タイプ	特に秋冬向け。和のシーン向け。食中酒向け。男性向け。日本酒通向け	15℃前後または35～45℃	焼き物のぐい飲み、平杯など	おでん、よせ鍋、肉じゃが、煮魚、天ぷら、鮭のホイル焼きなどの家庭料理と好相性	
/fbo/web/app.php/user/product/247	久寿玉　手作り純米酒	NA	1800ml	¥2,350	<使用米>ひだほまれ(60%)	＜麹米＞(%)	＜掛米＞(%)	きょうかい901号	速醸	15.5	+4	1.6	1.3	NA	濃醇な旨味を持つ純米酒。余韻の長さと原料米に由来するふくよかな香りが特徴	特に秋冬向け。男性向け。日本酒通向け。和のシーン向け。酒と肴向け。和食向け	18℃前後または40℃前後	焼き物のぐい飲み、蕎麦ちょこ、一般的な平杯など	牛肉の朴葉味噌焼き、猪鍋、鰤大根、キンキの煮付け、カニ味噌、ウニの塩漬け、シジミの佃煮、瓜の酒粕漬け	
/fbo/web/app.php/user/product/248	浦霞　特別純米　生一本	NA	1800ml	¥2,700	<使用米>ササニシキ(60%)	＜麹米＞(%)	＜掛米＞(%)	自社酵母	速醸	15.5	+1.5	1.5	1.5	NA	軽快な穀物香と柔らかな甘味とほんのりとした旨味が特徴。ややコクのあるタイプ	通年向け。男性向け。晩酌向け。居酒屋向け。食中酒向け	10～20℃または40～50℃	一般的なぐい飲み、猪口類など	鍋料理全般、焼魚、煮魚、焼鳥、おひたし、豆腐料理、卵料理など	
/fbo/web/app.php/user/product/250	香露　特別純米酒	NA	1800ml	¥2,752	<使用米>(%)	＜麹米＞山田錦(55%)	＜掛米＞神力(60%)	熊本酵母	高温糖化	15	+2	1.6	1.9	NA	輪郭がはっきりした純米酒	オールマイティではあるが中高年、通年向けだが秋～冬	5℃～50℃	焼き物、ぐい飲み、瀬戸物、	ぶりの塩焼き、焼き鳥、各種あみやき	
/fbo/web/app.php/user/product/257	澤乃井　純米　大辛口	NA	1800ml	¥2,240	<使用米>(%)	＜麹米＞アケボノ(65%)	＜掛米＞ふさおとめ(65%)	きょうかい901号	速醸	15.5	+11	1.8	1.2	NA	ほどよいコクを持った辛口タイプの純米酒	男性向け。特に秋冬向け。酒と肴＆食中酒向け。辛口フリーク向け	15℃前後または45℃前後	大振りの平杯、一般的なグイ呑みなど	肉じゃが、ブリ大根、鯖の味噌煮、鶏肉の照焼き、イカの沖漬け、イクラの醤油漬け、豆腐の味噌漬けなど	
/fbo/web/app.php/user/product/258	八鶴　純米　蔵物語	NA	1800ml	¥2,233	<使用米>華吹雪(60%)	＜麹米＞(%)	＜掛米＞(%)	きょうかい10号	速醸	15.5	+4	1.4	1.5	NA	落ち着いた穀物香。なめらかなテクスチャー。バランスよくまとまった味わいの構成。	特に秋冬向け。男性向け。家庭料理向け。常温からぬる燗向け	20℃前後又は40℃前後	白磁の平杯、薄手のグイ呑みなど	肉じゃが、すきやき、味噌田楽、キンメの煮付け、鰆の西京味噌焼き、おから、酒粕汁など	
/fbo/web/app.php/user/product/259	信濃錦「かかし」純米	NA	1800ml	¥1,952	<使用米>美山錦(70%)	＜麹米＞(%)	＜掛米＞(%)	きょうかい11号	速醸	15.5	+6	1.7	1.4	NA	濃厚な旨味を持つ純米酒。ふくよかな穀物香と余韻の長い旨味が特徴。	特に秋冬向け。男性向け。日本酒通向け。和食向け。常温から燗向け	20℃前後又は40℃前後	白磁のぐい呑み、大振りの平杯など	鯉こく、牛肉の朴葉味噌焼き、鴨の治部煮、アンコウ鍋、身欠きニシン、どじょうの柳川鍋、銀鱈の粕漬け焼き	
/fbo/web/app.php/user/product/260	日置桜　純米酒	NA	1800ml	¥2,350	<使用米>玉栄(65%)	＜麹米＞(%)	＜掛米＞(%)	きょうかい9号	速醸	15.5	+9	2	1.2	NA	木質系の引き締まった香り。厚みのある苦味を中心とした個性的な味わい	どちらかというと日本酒通向け。秋の夜長に季節の料理と共に	20℃前後又は40〜45℃前後	一般的な陶器のぐい呑みなど	〆サバ、カツオのタタキ、魚介の寄せ鍋、牛肉のしゃぶしゃぶなど	
/fbo/web/app.php/user/product/268	菊姫　金劔	NA	1800ml	¥2,762	<使用米>山田錦(65%)	＜麹米＞(%)	＜掛米＞(%)	自社酵母	速醸	15.8	+0.5	1.7	1.7	NA	濃醇な味わいの純米酒。旨味の余韻が長さが特徴。ぬる燗にすると真価を発揮。	日本酒通向け。男性向け。濃厚な和食向け。ぬる燗向け。酒と肴の組合せ向け。	20℃前後または40〜45℃前後	陶器の猪口、ぐい呑み、など	アジのなめろう、ブリのあら煮、石狩鍋、牛肉の粕漬け、牡丹鍋など濃厚な料理と好相性	
/fbo/web/app.php/user/product/269	信濃錦　特別純米　芳醇純米	NA	1800ml	¥2,400	<使用米>美山錦(61%)	＜麹米＞(%)	＜掛米＞(%)	きょうかい1401号	速醸	15.5	+3	1.5	1.3	NA	個性が強い酒ではないが、香りと味わいのバランス、旨味や苦味を中心とした５味のバランスがいい	日本酒通向け。ややカジュアルなシーン向け。特に和食向け。常温から燗向け。	18℃前後または40〜45℃	一般的な陶器、磁器の猪口、ぐい呑みなど	戻りカツオのたたき、サンマの塩焼き、カレイの煮付け、鯉こく、馬刺、牛肉の朴葉味噌焼きなど	
/fbo/web/app.php/user/product/270	富久錦　純米	NA	1800ml	¥2,100	<使用米>キヌヒカリ(70%)	＜麹米＞(%)	＜掛米＞(%)	きょうかい901号	速醸	15.4	+2	1.5	1.8	NA	ナッツ類のようなふくよかな香りが主体。甘味と酸味を感じるが、中盤から旨味と苦味が広がり、余韻まで続く	日本酒通向け。ややフォーマル向け（和）。食中酒向け。常温から燗向け。	20℃前後または40〜45℃前後	一般的な陶器や磁器の猪口、ぐい呑み	戻りカツオのたたき、サンマの塩焼き、カレイの煮付け、ぼたん鍋、栗入り五目煮、鶏肉とカシューナッツ炒め	
/fbo/web/app.php/user/product/272	澤乃井　純米銀印	NA	1800ml	¥1,850	<使用米>(%)	＜麹米＞アケボノ(65%)	＜掛米＞ふさおとめ(80%)	きょうかい901号	速醸	14.5	+1	1.7	1.2	NA	香り、味とも、純米酒らしいふくよかさ。コクのある辛口。	玄人好みのスタイル。食中酒としてじっくり味わえるタイプ。	常温の冷や(15℃)からぬる燗が、おすすめ。	美しい山吹色を生かす、白い酒器が良い。	穴子の照り焼き、関東風おでん、佃煮など。	
/fbo/web/app.php/user/product/273	月の桂　純米酒	NA	1800ml	¥2,400	<使用米>五百万石(55%)	＜麹米＞(%)	＜掛米＞(%)	きょうかい901号	速醸	15.6	+2	1.7	1.5	NA	甘やかな原料香。柔らかで刺激的要素の少ない味わいが特徴。アタックで感じる甘味が明確	通年向け。女性向け。グルメユーザー向け。京料理向け。和のシーン向け	10～15℃または35～40℃	清水焼の猪口、ぐい呑みなど（薄手の形状が好ましい）	京料理料理、甘鯛の若狭焼き、鱧の湯引き、胡麻豆腐、平目の酒蒸し、伊勢海老のお造りなどと好相性	
/fbo/web/app.php/user/product/274	千代寿　純米酒　大虎	NA	1800ml	¥1,930	<使用米>はえぬき(70%)	＜麹米＞(%)	＜掛米＞(%)	きょうかい7号	速醸	15.3	+10	1.5	1.2	NA	ドライな後味が特徴の純米酒。キレのよい飲み口が特徴	特に夏向け。男性向け。カジュアルなシーン向け。食中酒向け	10～15℃前後または50℃前後	小型タンブラー、小型ロックグラス、シェリーグラスなど	戻りカツオのタタキ、マグロ中トロ、鯖の塩焼き、鰤大根、鰻の蒲焼き、キンメダイの煮付けなどと好相性	
/fbo/web/app.php/user/product/278	米鶴　特別純米　田恵	NA	1800ml	¥2,371	<使用米>美山錦(55%)	＜麹米＞(%)	＜掛米＞(%)	きょうかい1001号	速醸	15	+1	1.6	1.2	NA	軽快な原料香と菜類のような爽やかな香り。まろやかな飲み口。伸びやかな旨味が特徴	通年向け。日本酒通向け。和のシーン向け。食中酒向け。冷やでも燗でも対応可	10～20℃または40～50℃前後	磁器製の平杯、うりざね型のグラス、小型ワイングラスなど	セリのおひたし、山菜料理、海草サラダ、鮎の塩焼きタデ酢、サザエの壺焼き、若竹煮、蕪と鶏肉の炊き合わせ	
