/fbo/web/app.php/user/product/282	豊の秋　特別純米　純米蔵出し	NA	1800ml	¥2,450	<使用米>(%)	＜麹米＞山田錦(58%)	＜掛米＞改良雄町・山田錦(58%)	きょうかい9号	速醸	15.5	+5	1.9	1.6	NA	原料米由来のふくよかな香りと旨味が明確な純米酒。非常にコクのある味わいで、余韻も長いフルボディテイスト	日本酒通向け。特に秋冬向け。島根県の郷土料理向け。伝統的な和食向け。ぬる燗向け。和のフォーマルシーン	20℃前後又は40℃前後	厚みのある焼き物のぐい呑みなど	出雲蕎麦、鰻の蒲焼き、牡蠣の土手鍋、猪鍋、鴨の炭火焼き、すきやきなど、旨味の濃い料理と好相性	
/fbo/web/app.php/user/product/285	簸上正宗　純米　七冠馬	NA	1800ml	¥2,170	<使用米>(%)	＜麹米＞神の舞(65%)	＜掛米＞五百万石(65%)	きょうかい901号・きょうかい701号	速醸	15	+2.5	1.6	1.3	NA	明るい山吹の色調。ふくよかな原料香が主体。非常にまろやかか印象。ボリューム感の高い豊かな味わい	日本酒通だけでなくワイン通向け。特に秋冬向け。和だけでなく洋のシーンにも向く。食中酒向け	18～22℃	ボルドー型グラス、大振りのうりざね型グラス、中型のグイ呑みなど	鰤大根、ノドグロの塩焼き、穴子の白焼き、牛テールの煮込み、ワタリガニのクリーム煮、白カビチーズ	
/fbo/web/app.php/user/product/288	西の関　上撰手造り　純米	NA	1800ml	¥2,544	<使用米>(%)	＜麹米＞八反錦(60%)	＜掛米＞ヒノヒカリ・八反錦(60%)	きょうかい9号	速醸	15.4	+1	1.4	-	NA	炊いた米などの原料由来の重みのある香り。どっしりとした甘味と旨味が主体の濃厚な味わい。	秋から冬にかけて。ヘビーユーザー向け。ぬる燗向け。	20℃前後または40℃前後	備前焼のグイ呑み、ボルドー型ワイングラス	コクのある料理と好相性。筑前煮、ぶり大根、牛肉朴葉焼き、豚ロース肉の味噌漬け、銀だら西京焼きなど	
/fbo/web/app.php/user/product/290	秀よし　寒造り　純米酒	NA	1800ml	¥2,330	<使用米>(%)	＜麹米＞めんこいな(60%)	＜掛米＞めんこいな(60%)	きょうかい1501号	速醸	15.5	+7	1.6	1.6	NA	やさしさを与える甘味。角のない酸味と苦味のドライテイスト。後味に残る旨味も特徴。	日本酒ビギナーから通まで対応可。特に和食とマッチ。冷やでも燗でも対応可。	15～20℃または35～40℃	磁器の猪口、フルートグラス、薄手の小型タンブラーなど	柔らかい食感の料理と好相性。白身魚のムース、生牡蠣レモン添え、アサリの酒蒸し、ハタハタ一夜干し	
/fbo/web/app.php/user/product/291	一人娘　純米　超辛口	NA	1800ml	¥2,476	<使用米>(%)	＜麹米＞ゆめひたち(55%)	＜掛米＞ゆめひたち(60%)	きょうかい701号	速醸	15.5	+4	1.1	1.2	NA	乳製品を思わせるふくよかで複雑な香り、苦味と旨味によるボリューム感のある味わい。	秋から冬にかけて。ヘビーユーザー向け。ぬる燗向け。	20℃前後または40℃前後	一般的な陶器のぐい呑みなど	クリームなどを使用した濃厚な料理が好相性。クラムチャウダー、シーフードグラタン、あんこう鍋など	
/fbo/web/app.php/user/product/293	七笑　純米酒	NA	1800ml	¥2,233	<使用米>美山錦(60%)	＜麹米＞(%)	＜掛米＞(%)	きょうかい1001号	速醸	15	+2	1.5	1.3	NA	ふくよかで落ちつきのある香りとドライテイストな味わいが特徴。燗にすることにより旨味が広がる。	特に秋冬向け。日本酒通向け。和のシーン向け。食中酒向け。燗向け。	20℃前後または40℃前後	陶器のぐい呑み、ボルドー型ワイングラス	濃厚な味わいの料理と好相性。飛騨牛グリル、鴨胸肉のソテー、うにの貝焼き、身欠きニシンなど	
/fbo/web/app.php/user/product/294	男山　生もと本醸造	NA	1800ml	¥1,953	<使用米>美山錦(60%)	＜麹米＞(%)	＜掛米＞(%)	自社酵母	速醸	15	+3	1.5	1.3	生酛仕込み	ふくよかな香り。ドライな味わい。旨味を伴った厚みのある酸味が特徴。	特に秋冬向け。日本酒通向け。和のシーン向け。食中酒向け。燗向け。	20℃前後または40～45℃前後	陶器のぐい呑み、ボルドー型ワイングラス	クリーミーな料理と好相性。白身魚のバターソテー、かにクリームコロッケ、石狩鍋、イクラの醤油漬けなど	
/fbo/web/app.php/user/product/295	飛良泉　山廃本醸造	NA	1800ml	¥2,300	<使用米>美山錦(60%)	＜麹米＞(%)	＜掛米＞(%)	自社酵母	山廃	15	+8	1.5	0.8	山廃仕込み	淡い山吹色の色調。ふくよかな香り。味わいはドライで、カスタードクリームを思わせる含み香が高いことが特徴。	特に秋冬向け。日本酒通向け。和のシーン向け。食中酒向け。燗向け。	20℃前後または40℃前後	備前焼のぐい呑みや猪口、小型のブランデーグラス、白磁の平杯	濃厚な味わいの料理、クリーミーな料理と好相性。きりたんぽ鍋、しょっつる鍋、ぶり大根、エビチリなど	
/fbo/web/app.php/user/product/296	大七　からくち生酛	NA	720ml/1800ml	1,129/2,258	<使用米>五百万石(69%)	＜麹米＞(%)	＜掛米＞(%)	きょうかい7号	生もと	15.5	+13	1.6	1.1	生酛仕込み	生クリームや金平糖などの上品な香り。味わいは酸味と苦味が主体のドライテイスト。	特に秋冬向け。ビギナー、日本酒通どちらも対応可。和のシーン向け。食中酒向け。燗向け。	20℃前後または40～45℃前後	陶器のぐい呑み	明確な旨味を持つ料理と同調。チーズフォンデュ、チキンカツレツ、鯛の香草焼き、ふろふき大根など	
/fbo/web/app.php/user/product/298	白真弓　本醸造　やんちゃ酒	1.5	1800ml	¥2,150	<使用米>ひだほまれ・ひとめぼれ(60%)	＜麹米＞(%)	＜掛米＞(%)	きょうかい9号	速醸	15	+0	1.9	NA	NA	乳製品やキノコ類を思わせる熟成した香りに反して味わいは軽やか。キレのある苦味が特徴。	秋から冬にかけて。ヘビーユーザー向け。	20℃前後または40℃前後	備前焼のぐい呑み、ボルドー型ワイングラス	濃厚なコクを持つ料理と好相性。チキンソテー、ローストポーク、ビーフシチュー、味噌煮込みうどんなど	
/fbo/web/app.php/user/product/306	西の関　上撰　本醸造　辛口	NA	1800ml	¥2,050	<使用米>(%)	＜麹米＞八反錦(60%)	＜掛米＞ヒノヒカリ(65%)	きょうかい901号	速醸	15.5	+4	1.1	1.2	NA	甘い穀物を思わせるふくよかな香りが主体。やわらかく優しい味わい。中盤から旨味と共に甘味が感じられる。後味はややドライ	特に秋冬向け。日本酒通向け。伝統的な和食向け。常温またはぬる燗向け	18℃前後または40℃前後	白磁のグイ呑み、やや大振りの猪口、一般的な平杯など	肉じゃが、筑前煮、茄子田楽、きんぴらごぼう、鰯の生姜煮、粕汁、鰺の南蛮漬けなど伝統的な和食と好相性	
